{
  "ok": true,
  "saved_files": {
    "invoices": {
      "path": "/Users/raktimverma/Desktop/HPL/customer-portal/exports/invoices.jsonl",
      "rows": 5455
    },
    "invoice_lines": {
      "path": "/Users/raktimverma/Desktop/HPL/customer-portal/exports/invoice_lines.jsonl",
      "rows": 12916
    },
    "invoice_payments": {
      "path": "/Users/raktimverma/Desktop/HPL/customer-portal/exports/invoice_payments.jsonl",
      "rows": 5005
    }
  },
  "compare": {
    "summary": {
      "invoices_in_file": 5455,
      "invoices_in_db": 5484,
      "new_invoices": 0,
      "missing_in_files": 29,
      "lines_in_file": 12916,
      "lines_in_db": 6000,
      "payments_in_file": 5005,
      "payments_in_db": 4574,
      "totals_mismatch": 73,
      "balance_mismatch": 0,
      "changed_invoices": 5455,
      "added_lines": 6916,
      "removed_lines": 0,
      "changed_lines": 0,
      "added_payments": 431,
      "removed_payments": 0,
      "changed_payments": 4574
    },
    "invoices": {
      "new": [],
      "missingInFiles": [
        38872,
        83800,
        83872,
        113627,
        119745,
        182741,
        242187,
        245295,
        246045,
        258067,
        263536,
        264930,
        264933,
        265425,
        265923,
        266621,
        267753,
        267765,
        269450,
        272966,
        274165,
        278485,
        281315,
        282318,
        284145,
        285033,
        287901,
        288005,
        293239
      ],
      "changed": [
        {
          "invoice_id": 24849,
          "changes": {
            "trandate": {
              "before": "2025-09-03",
              "after": "9/3/2025"
            }
          }
        },
        {
          "invoice_id": 25269,
          "changes": {
            "trandate": {
              "before": "2025-09-03",
              "after": "9/3/2025"
            }
          }
        },
        {
          "invoice_id": 24965,
          "changes": {
            "trandate": {
              "before": "2025-09-03",
              "after": "9/3/2025"
            }
          }
        },
        {
          "invoice_id": 24959,
          "changes": {
            "trandate": {
              "before": "2025-09-03",
              "after": "9/3/2025"
            }
          }
        },
        {
          "invoice_id": 29012,
          "changes": {
            "trandate": {
              "before": "2025-09-04",
              "after": "9/4/2025"
            }
          }
        },
        {
          "invoice_id": 29334,
          "changes": {
            "trandate": {
              "before": "2025-09-04",
              "after": "9/4/2025"
            }
          }
        },
        {
          "invoice_id": 19652,
          "changes": {
            "trandate": {
              "before": "2025-09-02",
              "after": "9/2/2025"
            }
          }
        },
        {
          "invoice_id": 19640,
          "changes": {
            "trandate": {
              "before": "2025-09-02",
              "after": "9/2/2025"
            }
          }
        },
        {
          "invoice_id": 19328,
          "changes": {
            "trandate": {
              "before": "2025-09-02",
              "after": "9/2/2025"
            }
          }
        },
        {
          "invoice_id": 20146,
          "changes": {
            "trandate": {
              "before": "2025-09-02",
              "after": "9/2/2025"
            }
          }
        },
        {
          "invoice_id": 20145,
          "changes": {
            "trandate": {
              "before": "2025-09-02",
              "after": "9/2/2025"
            }
          }
        },
        {
          "invoice_id": 28573,
          "changes": {
            "trandate": {
              "before": "2025-09-04",
              "after": "9/4/2025"
            }
          }
        },
        {
          "invoice_id": 28904,
          "changes": {
            "trandate": {
              "before": "2025-09-04",
              "after": "9/4/2025"
            }
          }
        },
        {
          "invoice_id": 28472,
          "changes": {
            "trandate": {
              "before": "2025-09-04",
              "after": "9/4/2025"
            }
          }
        },
        {
          "invoice_id": 31668,
          "changes": {
            "trandate": {
              "before": "2025-09-04",
              "after": "9/4/2025"
            }
          }
        },
        {
          "invoice_id": 38363,
          "changes": {
            "trandate": {
              "before": "2025-09-05",
              "after": "9/5/2025"
            }
          }
        },
        {
          "invoice_id": 38442,
          "changes": {
            "trandate": {
              "before": "2025-09-05",
              "after": "9/5/2025"
            }
          }
        },
        {
          "invoice_id": 38368,
          "changes": {
            "trandate": {
              "before": "2025-09-05",
              "after": "9/5/2025"
            }
          }
        },
        {
          "invoice_id": 38864,
          "changes": {
            "trandate": {
              "before": "2025-09-05",
              "after": "9/5/2025"
            }
          }
        },
        {
          "invoice_id": 38381,
          "changes": {
            "trandate": {
              "before": "2025-09-05",
              "after": "9/5/2025"
            }
          }
        },
        {
          "invoice_id": 38385,
          "changes": {
            "trandate": {
              "before": "2025-09-05",
              "after": "9/5/2025"
            }
          }
        },
        {
          "invoice_id": 38608,
          "changes": {
            "trandate": {
              "before": "2025-09-05",
              "after": "9/5/2025"
            }
          }
        },
        {
          "invoice_id": 38378,
          "changes": {
            "trandate": {
              "before": "2025-09-05",
              "after": "9/5/2025"
            }
          }
        },
        {
          "invoice_id": 38395,
          "changes": {
            "trandate": {
              "before": "2025-09-05",
              "after": "9/5/2025"
            }
          }
        },
        {
          "invoice_id": 38637,
          "changes": {
            "trandate": {
              "before": "2025-09-05",
              "after": "9/5/2025"
            }
          }
        },
        {
          "invoice_id": 38878,
          "changes": {
            "trandate": {
              "before": "2025-09-05",
              "after": "9/5/2025"
            }
          }
        },
        {
          "invoice_id": 38641,
          "changes": {
            "trandate": {
              "before": "2025-09-05",
              "after": "9/5/2025"
            }
          }
        },
        {
          "invoice_id": 38645,
          "changes": {
            "trandate": {
              "before": "2025-09-05",
              "after": "9/5/2025"
            }
          }
        },
        {
          "invoice_id": 38652,
          "changes": {
            "trandate": {
              "before": "2025-09-05",
              "after": "9/5/2025"
            }
          }
        },
        {
          "invoice_id": 38662,
          "changes": {
            "trandate": {
              "before": "2025-09-05",
              "after": "9/5/2025"
            }
          }
        },
        {
          "invoice_id": 38437,
          "changes": {
            "trandate": {
              "before": "2025-09-05",
              "after": "9/5/2025"
            }
          }
        },
        {
          "invoice_id": 38665,
          "changes": {
            "trandate": {
              "before": "2025-09-05",
              "after": "9/5/2025"
            }
          }
        },
        {
          "invoice_id": 38676,
          "changes": {
            "trandate": {
              "before": "2025-09-05",
              "after": "9/5/2025"
            }
          }
        },
        {
          "invoice_id": 38681,
          "changes": {
            "trandate": {
              "before": "2025-09-05",
              "after": "9/5/2025"
            }
          }
        },
        {
          "invoice_id": 38470,
          "changes": {
            "trandate": {
              "before": "2025-09-05",
              "after": "9/5/2025"
            }
          }
        },
        {
          "invoice_id": 38396,
          "changes": {
            "trandate": {
              "before": "2025-09-05",
              "after": "9/5/2025"
            }
          }
        },
        {
          "invoice_id": 38473,
          "changes": {
            "trandate": {
              "before": "2025-09-05",
              "after": "9/5/2025"
            }
          }
        },
        {
          "invoice_id": 38405,
          "changes": {
            "trandate": {
              "before": "2025-09-05",
              "after": "9/5/2025"
            }
          }
        },
        {
          "invoice_id": 38700,
          "changes": {
            "trandate": {
              "before": "2025-09-05",
              "after": "9/5/2025"
            }
          }
        },
        {
          "invoice_id": 37776,
          "changes": {
            "trandate": {
              "before": "2025-09-05",
              "after": "9/5/2025"
            }
          }
        },
        {
          "invoice_id": 38483,
          "changes": {
            "trandate": {
              "before": "2025-09-05",
              "after": "9/5/2025"
            }
          }
        },
        {
          "invoice_id": 38710,
          "changes": {
            "trandate": {
              "before": "2025-09-05",
              "after": "9/5/2025"
            }
          }
        },
        {
          "invoice_id": 38727,
          "changes": {
            "trandate": {
              "before": "2025-09-05",
              "after": "9/5/2025"
            }
          }
        },
        {
          "invoice_id": 38519,
          "changes": {
            "trandate": {
              "before": "2025-09-05",
              "after": "9/5/2025"
            }
          }
        },
        {
          "invoice_id": 38536,
          "changes": {
            "trandate": {
              "before": "2025-09-05",
              "after": "9/5/2025"
            }
          }
        },
        {
          "invoice_id": 38742,
          "changes": {
            "trandate": {
              "before": "2025-09-05",
              "after": "9/5/2025"
            }
          }
        },
        {
          "invoice_id": 38746,
          "changes": {
            "trandate": {
              "before": "2025-09-05",
              "after": "9/5/2025"
            }
          }
        },
        {
          "invoice_id": 38880,
          "changes": {
            "trandate": {
              "before": "2025-09-05",
              "after": "9/5/2025"
            }
          }
        },
        {
          "invoice_id": 39080,
          "changes": {
            "trandate": {
              "before": "2025-09-05",
              "after": "9/5/2025"
            }
          }
        },
        {
          "invoice_id": 39084,
          "changes": {
            "trandate": {
              "before": "2025-09-05",
              "after": "9/5/2025"
            }
          }
        },
        {
          "invoice_id": 39091,
          "changes": {
            "trandate": {
              "before": "2025-09-05",
              "after": "9/5/2025"
            }
          }
        },
        {
          "invoice_id": 39095,
          "changes": {
            "trandate": {
              "before": "2025-09-05",
              "after": "9/5/2025"
            }
          }
        },
        {
          "invoice_id": 38570,
          "changes": {
            "trandate": {
              "before": "2025-09-05",
              "after": "9/5/2025"
            }
          }
        },
        {
          "invoice_id": 39129,
          "changes": {
            "trandate": {
              "before": "2025-09-05",
              "after": "9/5/2025"
            }
          }
        },
        {
          "invoice_id": 39117,
          "changes": {
            "trandate": {
              "before": "2025-09-05",
              "after": "9/5/2025"
            }
          }
        },
        {
          "invoice_id": 38913,
          "changes": {
            "trandate": {
              "before": "2025-09-05",
              "after": "9/5/2025"
            }
          }
        },
        {
          "invoice_id": 38577,
          "changes": {
            "trandate": {
              "before": "2025-09-05",
              "after": "9/5/2025"
            }
          }
        },
        {
          "invoice_id": 38951,
          "changes": {
            "trandate": {
              "before": "2025-09-05",
              "after": "9/5/2025"
            }
          }
        },
        {
          "invoice_id": 38586,
          "changes": {
            "trandate": {
              "before": "2025-09-05",
              "after": "9/5/2025"
            }
          }
        },
        {
          "invoice_id": 39042,
          "changes": {
            "trandate": {
              "before": "2025-09-05",
              "after": "9/5/2025"
            }
          }
        },
        {
          "invoice_id": 39050,
          "changes": {
            "trandate": {
              "before": "2025-09-05",
              "after": "9/5/2025"
            }
          }
        },
        {
          "invoice_id": 39058,
          "changes": {
            "trandate": {
              "before": "2025-09-05",
              "after": "9/5/2025"
            }
          }
        },
        {
          "invoice_id": 39025,
          "changes": {
            "trandate": {
              "before": "2025-09-05",
              "after": "9/5/2025"
            }
          }
        },
        {
          "invoice_id": 39033,
          "changes": {
            "trandate": {
              "before": "2025-09-05",
              "after": "9/5/2025"
            }
          }
        },
        {
          "invoice_id": 38897,
          "changes": {
            "trandate": {
              "before": "2025-09-05",
              "after": "9/5/2025"
            }
          }
        },
        {
          "invoice_id": 38941,
          "changes": {
            "trandate": {
              "before": "2025-09-05",
              "after": "9/5/2025"
            }
          }
        },
        {
          "invoice_id": 38945,
          "changes": {
            "trandate": {
              "before": "2025-09-05",
              "after": "9/5/2025"
            }
          }
        },
        {
          "invoice_id": 38546,
          "changes": {
            "trandate": {
              "before": "2025-09-05",
              "after": "9/5/2025"
            }
          }
        },
        {
          "invoice_id": 46000,
          "changes": {
            "trandate": {
              "before": "2025-09-06",
              "after": "9/6/2025"
            }
          }
        },
        {
          "invoice_id": 46006,
          "changes": {
            "trandate": {
              "before": "2025-09-06",
              "after": "9/6/2025"
            }
          }
        },
        {
          "invoice_id": 48222,
          "changes": {
            "trandate": {
              "before": "2025-09-07",
              "after": "9/7/2025"
            }
          }
        },
        {
          "invoice_id": 45098,
          "changes": {
            "trandate": {
              "before": "2025-09-06",
              "after": "9/6/2025"
            }
          }
        },
        {
          "invoice_id": 48049,
          "changes": {
            "trandate": {
              "before": "2025-09-07",
              "after": "9/7/2025"
            }
          }
        },
        {
          "invoice_id": 48435,
          "changes": {
            "trandate": {
              "before": "2025-09-07",
              "after": "9/7/2025"
            }
          }
        },
        {
          "invoice_id": 49020,
          "changes": {
            "trandate": {
              "before": "2025-09-07",
              "after": "9/7/2025"
            }
          }
        },
        {
          "invoice_id": 50423,
          "changes": {
            "trandate": {
              "before": "2025-09-08",
              "after": "9/8/2025"
            }
          }
        },
        {
          "invoice_id": 48520,
          "changes": {
            "trandate": {
              "before": "2025-09-07",
              "after": "9/7/2025"
            }
          }
        },
        {
          "invoice_id": 48626,
          "changes": {
            "trandate": {
              "before": "2025-09-07",
              "after": "9/7/2025"
            }
          }
        },
        {
          "invoice_id": 48629,
          "changes": {
            "trandate": {
              "before": "2025-09-07",
              "after": "9/7/2025"
            }
          }
        },
        {
          "invoice_id": 48722,
          "changes": {
            "trandate": {
              "before": "2025-09-07",
              "after": "9/7/2025"
            }
          }
        },
        {
          "invoice_id": 49322,
          "changes": {
            "trandate": {
              "before": "2025-09-07",
              "after": "9/7/2025"
            }
          }
        },
        {
          "invoice_id": 45408,
          "changes": {
            "trandate": {
              "before": "2025-09-06",
              "after": "9/6/2025"
            }
          }
        },
        {
          "invoice_id": 51224,
          "changes": {
            "trandate": {
              "before": "2025-09-08",
              "after": "9/8/2025"
            }
          }
        },
        {
          "invoice_id": 51227,
          "changes": {
            "trandate": {
              "before": "2025-09-08",
              "after": "9/8/2025"
            }
          }
        },
        {
          "invoice_id": 46002,
          "changes": {
            "trandate": {
              "before": "2025-09-06",
              "after": "9/6/2025"
            }
          }
        },
        {
          "invoice_id": 45802,
          "changes": {
            "trandate": {
              "before": "2025-09-06",
              "after": "9/6/2025"
            }
          }
        },
        {
          "invoice_id": 45805,
          "changes": {
            "trandate": {
              "before": "2025-09-06",
              "after": "9/6/2025"
            }
          }
        },
        {
          "invoice_id": 43599,
          "changes": {
            "trandate": {
              "before": "2025-09-06",
              "after": "9/6/2025"
            }
          }
        },
        {
          "invoice_id": 45702,
          "changes": {
            "trandate": {
              "before": "2025-09-06",
              "after": "9/6/2025"
            }
          }
        },
        {
          "invoice_id": 48430,
          "changes": {
            "trandate": {
              "before": "2025-09-07",
              "after": "9/7/2025"
            }
          }
        },
        {
          "invoice_id": 48431,
          "changes": {
            "trandate": {
              "before": "2025-09-07",
              "after": "9/7/2025"
            }
          }
        },
        {
          "invoice_id": 53136,
          "changes": {
            "trandate": {
              "before": "2025-09-08",
              "after": "9/8/2025"
            }
          }
        },
        {
          "invoice_id": 53052,
          "changes": {
            "trandate": {
              "before": "2025-09-08",
              "after": "9/8/2025"
            }
          }
        },
        {
          "invoice_id": 54841,
          "changes": {
            "trandate": {
              "before": "2025-09-08",
              "after": "9/8/2025"
            }
          }
        },
        {
          "invoice_id": 52035,
          "changes": {
            "trandate": {
              "before": "2025-09-08",
              "after": "9/8/2025"
            }
          }
        },
        {
          "invoice_id": 44301,
          "changes": {
            "trandate": {
              "before": "2025-09-06",
              "after": "9/6/2025"
            }
          }
        },
        {
          "invoice_id": 44302,
          "changes": {
            "trandate": {
              "before": "2025-09-06",
              "after": "9/6/2025"
            }
          }
        },
        {
          "invoice_id": 48728,
          "changes": {
            "trandate": {
              "before": "2025-09-07",
              "after": "9/7/2025"
            }
          }
        },
        {
          "invoice_id": 51225,
          "changes": {
            "trandate": {
              "before": "2025-09-08",
              "after": "9/8/2025"
            }
          }
        },
        {
          "invoice_id": 46010,
          "changes": {
            "trandate": {
              "before": "2025-09-06",
              "after": "9/6/2025"
            }
          }
        },
        {
          "invoice_id": 59639,
          "changes": {
            "trandate": {
              "before": "2025-09-09",
              "after": "9/9/2025"
            }
          }
        },
        {
          "invoice_id": 59845,
          "changes": {
            "trandate": {
              "before": "2025-09-09",
              "after": "9/9/2025"
            }
          }
        },
        {
          "invoice_id": 53537,
          "changes": {
            "trandate": {
              "before": "2025-09-08",
              "after": "9/8/2025"
            }
          }
        },
        {
          "invoice_id": 59637,
          "changes": {
            "trandate": {
              "before": "2025-09-09",
              "after": "9/9/2025"
            }
          }
        },
        {
          "invoice_id": 42199,
          "changes": {
            "trandate": {
              "before": "2025-09-05",
              "after": "9/5/2025"
            }
          }
        },
        {
          "invoice_id": 62762,
          "changes": {
            "trandate": {
              "before": "2025-09-10",
              "after": "9/10/2025"
            }
          }
        },
        {
          "invoice_id": 77948,
          "changes": {
            "trandate": {
              "before": "2025-09-12",
              "after": "9/12/2025"
            }
          }
        },
        {
          "invoice_id": 69594,
          "changes": {
            "trandate": {
              "before": "2025-09-10",
              "after": "9/10/2025"
            }
          }
        },
        {
          "invoice_id": 75223,
          "changes": {
            "trandate": {
              "before": "2025-09-12",
              "after": "9/12/2025"
            }
          }
        },
        {
          "invoice_id": 77650,
          "changes": {
            "trandate": {
              "before": "2025-09-12",
              "after": "9/12/2025"
            }
          }
        },
        {
          "invoice_id": 83751,
          "changes": {
            "trandate": {
              "before": "2025-09-15",
              "after": "9/15/2025"
            }
          }
        },
        {
          "invoice_id": 70596,
          "changes": {
            "trandate": {
              "before": "2025-09-11",
              "after": "9/11/2025"
            }
          }
        },
        {
          "invoice_id": 74621,
          "changes": {
            "trandate": {
              "before": "2025-09-12",
              "after": "9/12/2025"
            }
          }
        },
        {
          "invoice_id": 83752,
          "changes": {
            "trandate": {
              "before": "2025-09-15",
              "after": "9/15/2025"
            }
          }
        },
        {
          "invoice_id": 76242,
          "changes": {
            "trandate": {
              "before": "2025-09-12",
              "after": "9/12/2025"
            }
          }
        },
        {
          "invoice_id": 78662,
          "changes": {
            "trandate": {
              "before": "2025-09-12",
              "after": "9/12/2025"
            }
          }
        },
        {
          "invoice_id": 62874,
          "changes": {
            "trandate": {
              "before": "2025-09-10",
              "after": "9/10/2025"
            }
          }
        },
        {
          "invoice_id": 83783,
          "changes": {
            "trandate": {
              "before": "2025-09-15",
              "after": "9/15/2025"
            }
          }
        },
        {
          "invoice_id": 83760,
          "changes": {
            "trandate": {
              "before": "2025-09-15",
              "after": "9/15/2025"
            }
          }
        },
        {
          "invoice_id": 70601,
          "changes": {
            "trandate": {
              "before": "2025-09-11",
              "after": "9/11/2025"
            }
          }
        },
        {
          "invoice_id": 76742,
          "changes": {
            "trandate": {
              "before": "2025-09-12",
              "after": "9/12/2025"
            }
          }
        },
        {
          "invoice_id": 75330,
          "changes": {
            "trandate": {
              "before": "2025-09-12",
              "after": "9/12/2025"
            }
          }
        },
        {
          "invoice_id": 74833,
          "changes": {
            "trandate": {
              "before": "2025-09-12",
              "after": "9/12/2025"
            }
          }
        },
        {
          "invoice_id": 83794,
          "changes": {
            "trandate": {
              "before": "2025-09-15",
              "after": "9/15/2025"
            }
          }
        },
        {
          "invoice_id": 65673,
          "changes": {
            "trandate": {
              "before": "2025-09-10",
              "after": "9/10/2025"
            }
          }
        },
        {
          "invoice_id": 78865,
          "changes": {
            "trandate": {
              "before": "2025-09-13",
              "after": "9/13/2025"
            }
          }
        },
        {
          "invoice_id": 69687,
          "changes": {
            "trandate": {
              "before": "2025-09-10",
              "after": "9/10/2025"
            }
          }
        },
        {
          "invoice_id": 83799,
          "changes": {
            "trandate": {
              "before": "2025-09-15",
              "after": "9/15/2025"
            }
          }
        },
        {
          "invoice_id": 62770,
          "changes": {
            "trandate": {
              "before": "2025-09-10",
              "after": "9/10/2025"
            }
          }
        },
        {
          "invoice_id": 71306,
          "changes": {
            "trandate": {
              "before": "2025-09-11",
              "after": "9/11/2025"
            }
          }
        },
        {
          "invoice_id": 62866,
          "changes": {
            "trandate": {
              "before": "2025-09-10",
              "after": "9/10/2025"
            }
          }
        },
        {
          "invoice_id": 76743,
          "changes": {
            "trandate": {
              "before": "2025-09-12",
              "after": "9/12/2025"
            }
          }
        },
        {
          "invoice_id": 83804,
          "changes": {
            "trandate": {
              "before": "2025-09-15",
              "after": "9/15/2025"
            }
          }
        },
        {
          "invoice_id": 61959,
          "changes": {
            "trandate": {
              "before": "2025-09-09",
              "after": "9/9/2025"
            }
          }
        },
        {
          "invoice_id": 78049,
          "changes": {
            "trandate": {
              "before": "2025-09-12",
              "after": "9/12/2025"
            }
          }
        },
        {
          "invoice_id": 83781,
          "changes": {
            "trandate": {
              "before": "2025-09-15",
              "after": "9/15/2025"
            }
          }
        },
        {
          "invoice_id": 83782,
          "changes": {
            "trandate": {
              "before": "2025-09-15",
              "after": "9/15/2025"
            }
          }
        },
        {
          "invoice_id": 79599,
          "changes": {
            "trandate": {
              "before": "2025-09-13",
              "after": "9/13/2025"
            }
          }
        },
        {
          "invoice_id": 81241,
          "changes": {
            "trandate": {
              "before": "2025-09-15",
              "after": "9/15/2025"
            }
          }
        },
        {
          "invoice_id": 82781,
          "changes": {
            "trandate": {
              "before": "2025-09-15",
              "after": "9/15/2025"
            }
          }
        },
        {
          "invoice_id": 79595,
          "changes": {
            "trandate": {
              "before": "2025-09-13",
              "after": "9/13/2025"
            }
          }
        },
        {
          "invoice_id": 59960,
          "changes": {
            "trandate": {
              "before": "2025-09-09",
              "after": "9/9/2025"
            }
          }
        },
        {
          "invoice_id": 62259,
          "changes": {
            "trandate": {
              "before": "2025-09-09",
              "after": "9/9/2025"
            }
          }
        },
        {
          "invoice_id": 72613,
          "changes": {
            "trandate": {
              "before": "2025-09-11",
              "after": "9/11/2025"
            }
          }
        },
        {
          "invoice_id": 61863,
          "changes": {
            "trandate": {
              "before": "2025-09-09",
              "after": "9/9/2025"
            }
          }
        },
        {
          "invoice_id": 61457,
          "changes": {
            "trandate": {
              "before": "2025-09-09",
              "after": "9/9/2025"
            }
          }
        },
        {
          "invoice_id": 61465,
          "changes": {
            "trandate": {
              "before": "2025-09-09",
              "after": "9/9/2025"
            }
          }
        },
        {
          "invoice_id": 66582,
          "changes": {
            "trandate": {
              "before": "2025-09-10",
              "after": "9/10/2025"
            }
          }
        },
        {
          "invoice_id": 79608,
          "changes": {
            "trandate": {
              "before": "2025-09-13",
              "after": "9/13/2025"
            }
          }
        },
        {
          "invoice_id": 61968,
          "changes": {
            "trandate": {
              "before": "2025-09-09",
              "after": "9/9/2025"
            }
          }
        },
        {
          "invoice_id": 83809,
          "changes": {
            "trandate": {
              "before": "2025-09-15",
              "after": "9/15/2025"
            }
          }
        },
        {
          "invoice_id": 83811,
          "changes": {
            "trandate": {
              "before": "2025-09-15",
              "after": "9/15/2025"
            }
          }
        },
        {
          "invoice_id": 83816,
          "changes": {
            "trandate": {
              "before": "2025-09-15",
              "after": "9/15/2025"
            }
          }
        },
        {
          "invoice_id": 83821,
          "changes": {
            "trandate": {
              "before": "2025-09-15",
              "after": "9/15/2025"
            }
          }
        },
        {
          "invoice_id": 83830,
          "changes": {
            "trandate": {
              "before": "2025-09-15",
              "after": "9/15/2025"
            }
          }
        },
        {
          "invoice_id": 18371,
          "changes": {
            "trandate": {
              "before": "2025-09-02",
              "after": "9/2/2025"
            }
          }
        },
        {
          "invoice_id": 17096,
          "changes": {
            "trandate": {
              "before": "2025-09-01",
              "after": "9/1/2025"
            }
          }
        },
        {
          "invoice_id": 24162,
          "changes": {
            "trandate": {
              "before": "2025-09-03",
              "after": "9/3/2025"
            }
          }
        },
        {
          "invoice_id": 24961,
          "changes": {
            "trandate": {
              "before": "2025-09-03",
              "after": "9/3/2025"
            }
          }
        },
        {
          "invoice_id": 24953,
          "changes": {
            "trandate": {
              "before": "2025-09-03",
              "after": "9/3/2025"
            }
          }
        },
        {
          "invoice_id": 30767,
          "changes": {
            "trandate": {
              "before": "2025-09-04",
              "after": "9/4/2025"
            }
          }
        },
        {
          "invoice_id": 19744,
          "changes": {
            "trandate": {
              "before": "2025-09-02",
              "after": "9/2/2025"
            }
          }
        },
        {
          "invoice_id": 21045,
          "changes": {
            "trandate": {
              "before": "2025-09-02",
              "after": "9/2/2025"
            }
          }
        },
        {
          "invoice_id": 21354,
          "changes": {
            "trandate": {
              "before": "2025-09-02",
              "after": "9/2/2025"
            }
          }
        },
        {
          "invoice_id": 21549,
          "changes": {
            "trandate": {
              "before": "2025-09-02",
              "after": "9/2/2025"
            }
          }
        },
        {
          "invoice_id": 22704,
          "changes": {
            "trandate": {
              "before": "2025-09-03",
              "after": "9/3/2025"
            }
          }
        },
        {
          "invoice_id": 23022,
          "changes": {
            "trandate": {
              "before": "2025-09-03",
              "after": "9/3/2025"
            }
          }
        },
        {
          "invoice_id": 23369,
          "changes": {
            "trandate": {
              "before": "2025-09-03",
              "after": "9/3/2025"
            }
          }
        },
        {
          "invoice_id": 22925,
          "changes": {
            "trandate": {
              "before": "2025-09-03",
              "after": "9/3/2025"
            }
          }
        },
        {
          "invoice_id": 37934,
          "changes": {
            "trandate": {
              "before": "2025-09-05",
              "after": "9/5/2025"
            }
          }
        },
        {
          "invoice_id": 38364,
          "changes": {
            "trandate": {
              "before": "2025-09-05",
              "after": "9/5/2025"
            }
          }
        },
        {
          "invoice_id": 38367,
          "changes": {
            "trandate": {
              "before": "2025-09-05",
              "after": "9/5/2025"
            }
          }
        },
        {
          "invoice_id": 38600,
          "changes": {
            "trandate": {
              "before": "2025-09-05",
              "after": "9/5/2025"
            }
          }
        },
        {
          "invoice_id": 38397,
          "changes": {
            "trandate": {
              "before": "2025-09-05",
              "after": "9/5/2025"
            }
          }
        },
        {
          "invoice_id": 38631,
          "changes": {
            "trandate": {
              "before": "2025-09-05",
              "after": "9/5/2025"
            }
          }
        },
        {
          "invoice_id": 38406,
          "changes": {
            "trandate": {
              "before": "2025-09-05",
              "after": "9/5/2025"
            }
          }
        },
        {
          "invoice_id": 38410,
          "changes": {
            "trandate": {
              "before": "2025-09-05",
              "after": "9/5/2025"
            }
          }
        },
        {
          "invoice_id": 38412,
          "changes": {
            "trandate": {
              "before": "2025-09-05",
              "after": "9/5/2025"
            }
          }
        },
        {
          "invoice_id": 38423,
          "changes": {
            "trandate": {
              "before": "2025-09-05",
              "after": "9/5/2025"
            }
          }
        },
        {
          "invoice_id": 38651,
          "changes": {
            "trandate": {
              "before": "2025-09-05",
              "after": "9/5/2025"
            }
          }
        },
        {
          "invoice_id": 38455,
          "changes": {
            "trandate": {
              "before": "2025-09-05",
              "after": "9/5/2025"
            }
          }
        },
        {
          "invoice_id": 38462,
          "changes": {
            "trandate": {
              "before": "2025-09-05",
              "after": "9/5/2025"
            }
          }
        },
        {
          "invoice_id": 38472,
          "changes": {
            "trandate": {
              "before": "2025-09-05",
              "after": "9/5/2025"
            }
          }
        },
        {
          "invoice_id": 38474,
          "changes": {
            "trandate": {
              "before": "2025-09-05",
              "after": "9/5/2025"
            }
          }
        },
        {
          "invoice_id": 38475,
          "changes": {
            "trandate": {
              "before": "2025-09-05",
              "after": "9/5/2025"
            }
          }
        },
        {
          "invoice_id": 38477,
          "changes": {
            "trandate": {
              "before": "2025-09-05",
              "after": "9/5/2025"
            }
          }
        },
        {
          "invoice_id": 38712,
          "changes": {
            "trandate": {
              "before": "2025-09-05",
              "after": "9/5/2025"
            }
          }
        },
        {
          "invoice_id": 38540,
          "changes": {
            "trandate": {
              "before": "2025-09-05",
              "after": "9/5/2025"
            }
          }
        },
        {
          "invoice_id": 38431,
          "changes": {
            "trandate": {
              "before": "2025-09-05",
              "after": "9/5/2025"
            }
          }
        },
        {
          "invoice_id": 38753,
          "changes": {
            "trandate": {
              "before": "2025-09-05",
              "after": "9/5/2025"
            }
          }
        },
        {
          "invoice_id": 38615,
          "changes": {
            "trandate": {
              "before": "2025-09-05",
              "after": "9/5/2025"
            }
          }
        },
        {
          "invoice_id": 38891,
          "changes": {
            "trandate": {
              "before": "2025-09-05",
              "after": "9/5/2025"
            }
          }
        },
        {
          "invoice_id": 39101,
          "changes": {
            "trandate": {
              "before": "2025-09-05",
              "after": "9/5/2025"
            }
          }
        },
        {
          "invoice_id": 39127,
          "changes": {
            "trandate": {
              "before": "2025-09-05",
              "after": "9/5/2025"
            }
          }
        },
        {
          "invoice_id": 39113,
          "changes": {
            "trandate": {
              "before": "2025-09-05",
              "after": "9/5/2025"
            }
          }
        },
        {
          "invoice_id": 39119,
          "changes": {
            "trandate": {
              "before": "2025-09-05",
              "after": "9/5/2025"
            }
          }
        },
        {
          "invoice_id": 38573,
          "changes": {
            "trandate": {
              "before": "2025-09-05",
              "after": "9/5/2025"
            }
          }
        },
        {
          "invoice_id": 38929,
          "changes": {
            "trandate": {
              "before": "2025-09-05",
              "after": "9/5/2025"
            }
          }
        },
        {
          "invoice_id": 38885,
          "changes": {
            "trandate": {
              "before": "2025-09-05",
              "after": "9/5/2025"
            }
          }
        },
        {
          "invoice_id": 38889,
          "changes": {
            "trandate": {
              "before": "2025-09-05",
              "after": "9/5/2025"
            }
          }
        },
        {
          "invoice_id": 37199,
          "changes": {
            "trandate": {
              "before": "2025-09-05",
              "after": "9/5/2025"
            }
          }
        },
        {
          "invoice_id": 39001,
          "changes": {
            "trandate": {
              "before": "2025-09-05",
              "after": "9/5/2025"
            }
          }
        },
        {
          "invoice_id": 39056,
          "changes": {
            "trandate": {
              "before": "2025-09-05",
              "after": "9/5/2025"
            }
          }
        },
        {
          "invoice_id": 39075,
          "changes": {
            "trandate": {
              "before": "2025-09-05",
              "after": "9/5/2025"
            }
          }
        },
        {
          "invoice_id": 38971,
          "changes": {
            "trandate": {
              "before": "2025-09-05",
              "after": "9/5/2025"
            }
          }
        },
        {
          "invoice_id": 38523,
          "changes": {
            "trandate": {
              "before": "2025-09-05",
              "after": "9/5/2025"
            }
          }
        },
        {
          "invoice_id": 39071,
          "changes": {
            "trandate": {
              "before": "2025-09-05",
              "after": "9/5/2025"
            }
          }
        },
        {
          "invoice_id": 48633,
          "changes": {
            "trandate": {
              "before": "2025-09-07",
              "after": "9/7/2025"
            }
          }
        },
        {
          "invoice_id": 48050,
          "changes": {
            "trandate": {
              "before": "2025-09-07",
              "after": "9/7/2025"
            }
          }
        },
        {
          "invoice_id": 48223,
          "changes": {
            "trandate": {
              "before": "2025-09-07",
              "after": "9/7/2025"
            }
          }
        },
        {
          "invoice_id": 48922,
          "changes": {
            "trandate": {
              "before": "2025-09-07",
              "after": "9/7/2025"
            }
          }
        },
        {
          "invoice_id": 47734,
          "changes": {
            "trandate": {
              "before": "2025-09-07",
              "after": "9/7/2025"
            }
          }
        },
        {
          "invoice_id": 52734,
          "changes": {
            "trandate": {
              "before": "2025-09-08",
              "after": "9/8/2025"
            }
          }
        },
        {
          "invoice_id": 49531,
          "changes": {
            "trandate": {
              "before": "2025-09-07",
              "after": "9/7/2025"
            }
          }
        },
        {
          "invoice_id": 49931,
          "changes": {
            "trandate": {
              "before": "2025-09-07",
              "after": "9/7/2025"
            }
          }
        },
        {
          "invoice_id": 49122,
          "changes": {
            "trandate": {
              "before": "2025-09-07",
              "after": "9/7/2025"
            }
          }
        },
        {
          "invoice_id": 53447,
          "changes": {
            "trandate": {
              "before": "2025-09-08",
              "after": "9/8/2025"
            }
          }
        },
        {
          "invoice_id": 43600,
          "changes": {
            "trandate": {
              "before": "2025-09-06",
              "after": "9/6/2025"
            }
          }
        },
        {
          "invoice_id": 53054,
          "changes": {
            "trandate": {
              "before": "2025-09-08",
              "after": "9/8/2025"
            }
          }
        },
        {
          "invoice_id": 46813,
          "changes": {
            "trandate": {
              "before": "2025-09-07",
              "after": "9/7/2025"
            }
          }
        },
        {
          "invoice_id": 48624,
          "changes": {
            "trandate": {
              "before": "2025-09-07",
              "after": "9/7/2025"
            }
          }
        },
        {
          "invoice_id": 47720,
          "changes": {
            "trandate": {
              "before": "2025-09-07",
              "after": "9/7/2025"
            }
          }
        },
        {
          "invoice_id": 52126,
          "changes": {
            "trandate": {
              "before": "2025-09-08",
              "after": "9/8/2025"
            }
          }
        },
        {
          "invoice_id": 52440,
          "changes": {
            "trandate": {
              "before": "2025-09-08",
              "after": "9/8/2025"
            }
          }
        },
        {
          "invoice_id": 52637,
          "changes": {
            "trandate": {
              "before": "2025-09-08",
              "after": "9/8/2025"
            }
          }
        },
        {
          "invoice_id": 58731,
          "changes": {
            "trandate": {
              "before": "2025-09-09",
              "after": "9/9/2025"
            }
          }
        },
        {
          "invoice_id": 52433,
          "changes": {
            "trandate": {
              "before": "2025-09-08",
              "after": "9/8/2025"
            }
          }
        },
        {
          "invoice_id": 59946,
          "changes": {
            "trandate": {
              "before": "2025-09-09",
              "after": "9/9/2025"
            }
          }
        },
        {
          "invoice_id": 59527,
          "changes": {
            "trandate": {
              "before": "2025-09-09",
              "after": "9/9/2025"
            }
          }
        },
        {
          "invoice_id": 83807,
          "changes": {
            "trandate": {
              "before": "2025-09-15",
              "after": "9/15/2025"
            }
          }
        },
        {
          "invoice_id": 74620,
          "changes": {
            "trandate": {
              "before": "2025-09-12",
              "after": "9/12/2025"
            }
          }
        },
        {
          "invoice_id": 75539,
          "changes": {
            "trandate": {
              "before": "2025-09-12",
              "after": "9/12/2025"
            }
          }
        },
        {
          "invoice_id": 78250,
          "changes": {
            "trandate": {
              "before": "2025-09-12",
              "after": "9/12/2025"
            }
          }
        },
        {
          "invoice_id": 62873,
          "changes": {
            "trandate": {
              "before": "2025-09-10",
              "after": "9/10/2025"
            }
          }
        },
        {
          "invoice_id": 77452,
          "changes": {
            "trandate": {
              "before": "2025-09-12",
              "after": "9/12/2025"
            }
          }
        },
        {
          "invoice_id": 71410,
          "changes": {
            "trandate": {
              "before": "2025-09-11",
              "after": "9/11/2025"
            }
          }
        },
        {
          "invoice_id": 75122,
          "changes": {
            "trandate": {
              "before": "2025-09-12",
              "after": "9/12/2025"
            }
          }
        },
        {
          "invoice_id": 78668,
          "changes": {
            "trandate": {
              "before": "2025-09-13",
              "after": "9/13/2025"
            }
          }
        },
        {
          "invoice_id": 83754,
          "changes": {
            "trandate": {
              "before": "2025-09-15",
              "after": "9/15/2025"
            }
          }
        },
        {
          "invoice_id": 78969,
          "changes": {
            "trandate": {
              "before": "2025-09-13",
              "after": "9/13/2025"
            }
          }
        },
        {
          "invoice_id": 68383,
          "changes": {
            "trandate": {
              "before": "2025-09-10",
              "after": "9/10/2025"
            }
          }
        },
        {
          "invoice_id": 83789,
          "changes": {
            "trandate": {
              "before": "2025-09-15",
              "after": "9/15/2025"
            }
          }
        },
        {
          "invoice_id": 83765,
          "changes": {
            "trandate": {
              "before": "2025-09-15",
              "after": "9/15/2025"
            }
          }
        },
        {
          "invoice_id": 83791,
          "changes": {
            "trandate": {
              "before": "2025-09-15",
              "after": "9/15/2025"
            }
          }
        },
        {
          "invoice_id": 83766,
          "changes": {
            "trandate": {
              "before": "2025-09-15",
              "after": "9/15/2025"
            }
          }
        },
        {
          "invoice_id": 62878,
          "changes": {
            "trandate": {
              "before": "2025-09-10",
              "after": "9/10/2025"
            }
          }
        },
        {
          "invoice_id": 74926,
          "changes": {
            "trandate": {
              "before": "2025-09-12",
              "after": "9/12/2025"
            }
          }
        },
        {
          "invoice_id": 69293,
          "changes": {
            "trandate": {
              "before": "2025-09-10",
              "after": "9/10/2025"
            }
          }
        },
        {
          "invoice_id": 72614,
          "changes": {
            "trandate": {
              "before": "2025-09-11",
              "after": "9/11/2025"
            }
          }
        },
        {
          "invoice_id": 66376,
          "changes": {
            "trandate": {
              "before": "2025-09-10",
              "after": "9/10/2025"
            }
          }
        },
        {
          "invoice_id": 83801,
          "changes": {
            "trandate": {
              "before": "2025-09-15",
              "after": "9/15/2025"
            }
          }
        },
        {
          "invoice_id": 69488,
          "changes": {
            "trandate": {
              "before": "2025-09-10",
              "after": "9/10/2025"
            }
          }
        },
        {
          "invoice_id": 83805,
          "changes": {
            "trandate": {
              "before": "2025-09-15",
              "after": "9/15/2025"
            }
          }
        },
        {
          "invoice_id": 63764,
          "changes": {
            "trandate": {
              "before": "2025-09-10",
              "after": "9/10/2025"
            }
          }
        },
        {
          "invoice_id": 83734,
          "changes": {
            "trandate": {
              "before": "2025-09-15",
              "after": "9/15/2025"
            }
          }
        },
        {
          "invoice_id": 80401,
          "changes": {
            "trandate": {
              "before": "2025-09-13",
              "after": "9/13/2025"
            }
          }
        },
        {
          "invoice_id": 63064,
          "changes": {
            "trandate": {
              "before": "2025-09-10",
              "after": "9/10/2025"
            }
          }
        },
        {
          "invoice_id": 59952,
          "changes": {
            "trandate": {
              "before": "2025-09-09",
              "after": "9/9/2025"
            }
          }
        },
        {
          "invoice_id": 83096,
          "changes": {
            "trandate": {
              "before": "2025-09-15",
              "after": "9/15/2025"
            }
          }
        },
        {
          "invoice_id": 69595,
          "changes": {
            "trandate": {
              "before": "2025-09-10",
              "after": "9/10/2025"
            }
          }
        },
        {
          "invoice_id": 83307,
          "changes": {
            "trandate": {
              "before": "2025-09-15",
              "after": "9/15/2025"
            }
          }
        },
        {
          "invoice_id": 80601,
          "changes": {
            "trandate": {
              "before": "2025-09-13",
              "after": "9/13/2025"
            }
          }
        },
        {
          "invoice_id": 79602,
          "changes": {
            "trandate": {
              "before": "2025-09-13",
              "after": "9/13/2025"
            }
          }
        },
        {
          "invoice_id": 63665,
          "changes": {
            "trandate": {
              "before": "2025-09-10",
              "after": "9/10/2025"
            }
          }
        },
        {
          "invoice_id": 62363,
          "changes": {
            "trandate": {
              "before": "2025-09-09",
              "after": "9/9/2025"
            }
          }
        },
        {
          "invoice_id": 83737,
          "changes": {
            "trandate": {
              "before": "2025-09-15",
              "after": "9/15/2025"
            }
          }
        },
        {
          "invoice_id": 83739,
          "changes": {
            "trandate": {
              "before": "2025-09-15",
              "after": "9/15/2025"
            }
          }
        },
        {
          "invoice_id": 61859,
          "changes": {
            "trandate": {
              "before": "2025-09-09",
              "after": "9/9/2025"
            }
          }
        },
        {
          "invoice_id": 69193,
          "changes": {
            "trandate": {
              "before": "2025-09-10",
              "after": "9/10/2025"
            }
          }
        },
        {
          "invoice_id": 83742,
          "changes": {
            "trandate": {
              "before": "2025-09-15",
              "after": "9/15/2025"
            }
          }
        },
        {
          "invoice_id": 70598,
          "changes": {
            "trandate": {
              "before": "2025-09-11",
              "after": "9/11/2025"
            }
          }
        },
        {
          "invoice_id": 83619,
          "changes": {
            "trandate": {
              "before": "2025-09-15",
              "after": "9/15/2025"
            }
          }
        },
        {
          "invoice_id": 83817,
          "changes": {
            "trandate": {
              "before": "2025-09-15",
              "after": "9/15/2025"
            }
          }
        },
        {
          "invoice_id": 83829,
          "changes": {
            "trandate": {
              "before": "2025-09-15",
              "after": "9/15/2025"
            }
          }
        },
        {
          "invoice_id": 83633,
          "changes": {
            "trandate": {
              "before": "2025-09-15",
              "after": "9/15/2025"
            }
          }
        },
        {
          "invoice_id": 17960,
          "changes": {
            "trandate": {
              "before": "2025-09-02",
              "after": "9/2/2025"
            }
          }
        },
        {
          "invoice_id": 18368,
          "changes": {
            "trandate": {
              "before": "2025-09-02",
              "after": "9/2/2025"
            }
          }
        },
        {
          "invoice_id": 17951,
          "changes": {
            "trandate": {
              "before": "2025-09-02",
              "after": "9/2/2025"
            }
          }
        },
        {
          "invoice_id": 18071,
          "changes": {
            "trandate": {
              "before": "2025-09-02",
              "after": "9/2/2025"
            }
          }
        },
        {
          "invoice_id": 18268,
          "changes": {
            "trandate": {
              "before": "2025-09-02",
              "after": "9/2/2025"
            }
          }
        },
        {
          "invoice_id": 24656,
          "changes": {
            "trandate": {
              "before": "2025-09-03",
              "after": "9/3/2025"
            }
          }
        },
        {
          "invoice_id": 24153,
          "changes": {
            "trandate": {
              "before": "2025-09-03",
              "after": "9/3/2025"
            }
          }
        },
        {
          "invoice_id": 25264,
          "changes": {
            "trandate": {
              "before": "2025-09-03",
              "after": "9/3/2025"
            }
          }
        },
        {
          "invoice_id": 25753,
          "changes": {
            "trandate": {
              "before": "2025-09-03",
              "after": "9/3/2025"
            }
          }
        },
        {
          "invoice_id": 29410,
          "changes": {
            "trandate": {
              "before": "2025-09-04",
              "after": "9/4/2025"
            }
          }
        },
        {
          "invoice_id": 29318,
          "changes": {
            "trandate": {
              "before": "2025-09-04",
              "after": "9/4/2025"
            }
          }
        },
        {
          "invoice_id": 20076,
          "changes": {
            "trandate": {
              "before": "2025-09-02",
              "after": "9/2/2025"
            }
          }
        },
        {
          "invoice_id": 20947,
          "changes": {
            "trandate": {
              "before": "2025-09-02",
              "after": "9/2/2025"
            }
          }
        },
        {
          "invoice_id": 20078,
          "changes": {
            "trandate": {
              "before": "2025-09-02",
              "after": "9/2/2025"
            }
          }
        },
        {
          "invoice_id": 22920,
          "changes": {
            "trandate": {
              "before": "2025-09-03",
              "after": "9/3/2025"
            }
          }
        },
        {
          "invoice_id": 38359,
          "changes": {
            "trandate": {
              "before": "2025-09-05",
              "after": "9/5/2025"
            }
          }
        },
        {
          "invoice_id": 38435,
          "changes": {
            "trandate": {
              "before": "2025-09-05",
              "after": "9/5/2025"
            }
          }
        },
        {
          "invoice_id": 38372,
          "changes": {
            "trandate": {
              "before": "2025-09-05",
              "after": "9/5/2025"
            }
          }
        },
        {
          "invoice_id": 38865,
          "changes": {
            "trandate": {
              "before": "2025-09-05",
              "after": "9/5/2025"
            }
          }
        },
        {
          "invoice_id": 38369,
          "changes": {
            "trandate": {
              "before": "2025-09-05",
              "after": "9/5/2025"
            }
          }
        },
        {
          "invoice_id": 38383,
          "changes": {
            "trandate": {
              "before": "2025-09-05",
              "after": "9/5/2025"
            }
          }
        },
        {
          "invoice_id": 38624,
          "changes": {
            "trandate": {
              "before": "2025-09-05",
              "after": "9/5/2025"
            }
          }
        },
        {
          "invoice_id": 38876,
          "changes": {
            "trandate": {
              "before": "2025-09-05",
              "after": "9/5/2025"
            }
          }
        },
        {
          "invoice_id": 38390,
          "changes": {
            "trandate": {
              "before": "2025-09-05",
              "after": "9/5/2025"
            }
          }
        },
        {
          "invoice_id": 38408,
          "changes": {
            "trandate": {
              "before": "2025-09-05",
              "after": "9/5/2025"
            }
          }
        },
        {
          "invoice_id": 38679,
          "changes": {
            "trandate": {
              "before": "2025-09-05",
              "after": "9/5/2025"
            }
          }
        },
        {
          "invoice_id": 38683,
          "changes": {
            "trandate": {
              "before": "2025-09-05",
              "after": "9/5/2025"
            }
          }
        },
        {
          "invoice_id": 38466,
          "changes": {
            "trandate": {
              "before": "2025-09-05",
              "after": "9/5/2025"
            }
          }
        },
        {
          "invoice_id": 38393,
          "changes": {
            "trandate": {
              "before": "2025-09-05",
              "after": "9/5/2025"
            }
          }
        },
        {
          "invoice_id": 38691,
          "changes": {
            "trandate": {
              "before": "2025-09-05",
              "after": "9/5/2025"
            }
          }
        },
        {
          "invoice_id": 38479,
          "changes": {
            "trandate": {
              "before": "2025-09-05",
              "after": "9/5/2025"
            }
          }
        },
        {
          "invoice_id": 38485,
          "changes": {
            "trandate": {
              "before": "2025-09-05",
              "after": "9/5/2025"
            }
          }
        },
        {
          "invoice_id": 38487,
          "changes": {
            "trandate": {
              "before": "2025-09-05",
              "after": "9/5/2025"
            }
          }
        },
        {
          "invoice_id": 38708,
          "changes": {
            "trandate": {
              "before": "2025-09-05",
              "after": "9/5/2025"
            }
          }
        },
        {
          "invoice_id": 38715,
          "changes": {
            "trandate": {
              "before": "2025-09-05",
              "after": "9/5/2025"
            }
          }
        },
        {
          "invoice_id": 38495,
          "changes": {
            "trandate": {
              "before": "2025-09-05",
              "after": "9/5/2025"
            }
          }
        },
        {
          "invoice_id": 38413,
          "changes": {
            "trandate": {
              "before": "2025-09-05",
              "after": "9/5/2025"
            }
          }
        },
        {
          "invoice_id": 38424,
          "changes": {
            "trandate": {
              "before": "2025-09-05",
              "after": "9/5/2025"
            }
          }
        },
        {
          "invoice_id": 38730,
          "changes": {
            "trandate": {
              "before": "2025-09-05",
              "after": "9/5/2025"
            }
          }
        },
        {
          "invoice_id": 38560,
          "changes": {
            "trandate": {
              "before": "2025-09-05",
              "after": "9/5/2025"
            }
          }
        },
        {
          "invoice_id": 38757,
          "changes": {
            "trandate": {
              "before": "2025-09-05",
              "after": "9/5/2025"
            }
          }
        },
        {
          "invoice_id": 38758,
          "changes": {
            "trandate": {
              "before": "2025-09-05",
              "after": "9/5/2025"
            }
          }
        },
        {
          "invoice_id": 38760,
          "changes": {
            "trandate": {
              "before": "2025-09-05",
              "after": "9/5/2025"
            }
          }
        },
        {
          "invoice_id": 39083,
          "changes": {
            "trandate": {
              "before": "2025-09-05",
              "after": "9/5/2025"
            }
          }
        },
        {
          "invoice_id": 38917,
          "changes": {
            "trandate": {
              "before": "2025-09-05",
              "after": "9/5/2025"
            }
          }
        },
        {
          "invoice_id": 38581,
          "changes": {
            "trandate": {
              "before": "2025-09-05",
              "after": "9/5/2025"
            }
          }
        },
        {
          "invoice_id": 39021,
          "changes": {
            "trandate": {
              "before": "2025-09-05",
              "after": "9/5/2025"
            }
          }
        },
        {
          "invoice_id": 38986,
          "changes": {
            "trandate": {
              "before": "2025-09-05",
              "after": "9/5/2025"
            }
          }
        },
        {
          "invoice_id": 39020,
          "changes": {
            "trandate": {
              "before": "2025-09-05",
              "after": "9/5/2025"
            }
          }
        },
        {
          "invoice_id": 39029,
          "changes": {
            "trandate": {
              "before": "2025-09-05",
              "after": "9/5/2025"
            }
          }
        },
        {
          "invoice_id": 39060,
          "changes": {
            "trandate": {
              "before": "2025-09-05",
              "after": "9/5/2025"
            }
          }
        },
        {
          "invoice_id": 38931,
          "changes": {
            "trandate": {
              "before": "2025-09-05",
              "after": "9/5/2025"
            }
          }
        },
        {
          "invoice_id": 38934,
          "changes": {
            "trandate": {
              "before": "2025-09-05",
              "after": "9/5/2025"
            }
          }
        },
        {
          "invoice_id": 38987,
          "changes": {
            "trandate": {
              "before": "2025-09-05",
              "after": "9/5/2025"
            }
          }
        },
        {
          "invoice_id": 38538,
          "changes": {
            "trandate": {
              "before": "2025-09-05",
              "after": "9/5/2025"
            }
          }
        },
        {
          "invoice_id": 36727,
          "changes": {
            "trandate": {
              "before": "2025-09-05",
              "after": "9/5/2025"
            }
          }
        },
        {
          "invoice_id": 47728,
          "changes": {
            "trandate": {
              "before": "2025-09-07",
              "after": "9/7/2025"
            }
          }
        },
        {
          "invoice_id": 48034,
          "changes": {
            "trandate": {
              "before": "2025-09-07",
              "after": "9/7/2025"
            }
          }
        },
        {
          "invoice_id": 49534,
          "changes": {
            "trandate": {
              "before": "2025-09-07",
              "after": "9/7/2025"
            }
          }
        },
        {
          "invoice_id": 51223,
          "changes": {
            "trandate": {
              "before": "2025-09-08",
              "after": "9/8/2025"
            }
          }
        },
        {
          "invoice_id": 39755,
          "changes": {
            "trandate": {
              "before": "2025-09-05",
              "after": "9/5/2025"
            }
          }
        },
        {
          "invoice_id": 52331,
          "changes": {
            "trandate": {
              "before": "2025-09-08",
              "after": "9/8/2025"
            }
          }
        },
        {
          "invoice_id": 50726,
          "changes": {
            "trandate": {
              "before": "2025-09-08",
              "after": "9/8/2025"
            }
          }
        },
        {
          "invoice_id": 39520,
          "changes": {
            "trandate": {
              "before": "2025-09-05",
              "after": "9/5/2025"
            }
          }
        },
        {
          "invoice_id": 40525,
          "changes": {
            "trandate": {
              "before": "2025-09-05",
              "after": "9/5/2025"
            }
          }
        },
        {
          "invoice_id": 53048,
          "changes": {
            "trandate": {
              "before": "2025-09-08",
              "after": "9/8/2025"
            }
          }
        },
        {
          "invoice_id": 59026,
          "changes": {
            "trandate": {
              "before": "2025-09-09",
              "after": "9/9/2025"
            }
          }
        },
        {
          "invoice_id": 48121,
          "changes": {
            "trandate": {
              "before": "2025-09-07",
              "after": "9/7/2025"
            }
          }
        },
        {
          "invoice_id": 48640,
          "changes": {
            "trandate": {
              "before": "2025-09-07",
              "after": "9/7/2025"
            }
          }
        },
        {
          "invoice_id": 49724,
          "changes": {
            "trandate": {
              "before": "2025-09-07",
              "after": "9/7/2025"
            }
          }
        },
        {
          "invoice_id": 49732,
          "changes": {
            "trandate": {
              "before": "2025-09-07",
              "after": "9/7/2025"
            }
          }
        },
        {
          "invoice_id": 50425,
          "changes": {
            "trandate": {
              "before": "2025-09-08",
              "after": "9/8/2025"
            }
          }
        },
        {
          "invoice_id": 49727,
          "changes": {
            "trandate": {
              "before": "2025-09-07",
              "after": "9/7/2025"
            }
          }
        },
        {
          "invoice_id": 54743,
          "changes": {
            "trandate": {
              "before": "2025-09-08",
              "after": "9/8/2025"
            }
          }
        },
        {
          "invoice_id": 59738,
          "changes": {
            "trandate": {
              "before": "2025-09-09",
              "after": "9/9/2025"
            }
          }
        },
        {
          "invoice_id": 52651,
          "changes": {
            "trandate": {
              "before": "2025-09-08",
              "after": "9/8/2025"
            }
          }
        },
        {
          "invoice_id": 75634,
          "changes": {
            "trandate": {
              "before": "2025-09-12",
              "after": "9/12/2025"
            }
          }
        },
        {
          "invoice_id": 62060,
          "changes": {
            "trandate": {
              "before": "2025-09-09",
              "after": "9/9/2025"
            }
          }
        },
        {
          "invoice_id": 78962,
          "changes": {
            "trandate": {
              "before": "2025-09-13",
              "after": "9/13/2025"
            }
          }
        },
        {
          "invoice_id": 83755,
          "changes": {
            "trandate": {
              "before": "2025-09-15",
              "after": "9/15/2025"
            }
          }
        },
        {
          "invoice_id": 71305,
          "changes": {
            "trandate": {
              "before": "2025-09-11",
              "after": "9/11/2025"
            }
          }
        },
        {
          "invoice_id": 83757,
          "changes": {
            "trandate": {
              "before": "2025-09-15",
              "after": "9/15/2025"
            }
          }
        },
        {
          "invoice_id": 83787,
          "changes": {
            "trandate": {
              "before": "2025-09-15",
              "after": "9/15/2025"
            }
          }
        },
        {
          "invoice_id": 83790,
          "changes": {
            "trandate": {
              "before": "2025-09-15",
              "after": "9/15/2025"
            }
          }
        },
        {
          "invoice_id": 61149,
          "changes": {
            "trandate": {
              "before": "2025-09-09",
              "after": "9/9/2025"
            }
          }
        },
        {
          "invoice_id": 71411,
          "changes": {
            "trandate": {
              "before": "2025-09-11",
              "after": "9/11/2025"
            }
          }
        },
        {
          "invoice_id": 83768,
          "changes": {
            "trandate": {
              "before": "2025-09-15",
              "after": "9/15/2025"
            }
          }
        },
        {
          "invoice_id": 62273,
          "changes": {
            "trandate": {
              "before": "2025-09-09",
              "after": "9/9/2025"
            }
          }
        },
        {
          "invoice_id": 62058,
          "changes": {
            "trandate": {
              "before": "2025-09-09",
              "after": "9/9/2025"
            }
          }
        },
        {
          "invoice_id": 64971,
          "changes": {
            "trandate": {
              "before": "2025-09-10",
              "after": "9/10/2025"
            }
          }
        },
        {
          "invoice_id": 72618,
          "changes": {
            "trandate": {
              "before": "2025-09-11",
              "after": "9/11/2025"
            }
          }
        },
        {
          "invoice_id": 60746,
          "changes": {
            "trandate": {
              "before": "2025-09-09",
              "after": "9/9/2025"
            }
          }
        },
        {
          "invoice_id": 68895,
          "changes": {
            "trandate": {
              "before": "2025-09-10",
              "after": "9/10/2025"
            }
          }
        },
        {
          "invoice_id": 62280,
          "changes": {
            "trandate": {
              "before": "2025-09-09",
              "after": "9/9/2025"
            }
          }
        },
        {
          "invoice_id": 79596,
          "changes": {
            "trandate": {
              "before": "2025-09-13",
              "after": "9/13/2025"
            }
          }
        },
        {
          "invoice_id": 80201,
          "changes": {
            "trandate": {
              "before": "2025-09-13",
              "after": "9/13/2025"
            }
          }
        },
        {
          "invoice_id": 83095,
          "changes": {
            "trandate": {
              "before": "2025-09-15",
              "after": "9/15/2025"
            }
          }
        },
        {
          "invoice_id": 62468,
          "changes": {
            "trandate": {
              "before": "2025-09-09",
              "after": "9/9/2025"
            }
          }
        },
        {
          "invoice_id": 80302,
          "changes": {
            "trandate": {
              "before": "2025-09-13",
              "after": "9/13/2025"
            }
          }
        },
        {
          "invoice_id": 69294,
          "changes": {
            "trandate": {
              "before": "2025-09-10",
              "after": "9/10/2025"
            }
          }
        },
        {
          "invoice_id": 70493,
          "changes": {
            "trandate": {
              "before": "2025-09-11",
              "after": "9/11/2025"
            }
          }
        },
        {
          "invoice_id": 83741,
          "changes": {
            "trandate": {
              "before": "2025-09-15",
              "after": "9/15/2025"
            }
          }
        },
        {
          "invoice_id": 62471,
          "changes": {
            "trandate": {
              "before": "2025-09-09",
              "after": "9/9/2025"
            }
          }
        },
        {
          "invoice_id": 68987,
          "changes": {
            "trandate": {
              "before": "2025-09-10",
              "after": "9/10/2025"
            }
          }
        },
        {
          "invoice_id": 83744,
          "changes": {
            "trandate": {
              "before": "2025-09-15",
              "after": "9/15/2025"
            }
          }
        },
        {
          "invoice_id": 62764,
          "changes": {
            "trandate": {
              "before": "2025-09-10",
              "after": "9/10/2025"
            }
          }
        },
        {
          "invoice_id": 71005,
          "changes": {
            "trandate": {
              "before": "2025-09-11",
              "after": "9/11/2025"
            }
          }
        },
        {
          "invoice_id": 83823,
          "changes": {
            "trandate": {
              "before": "2025-09-15",
              "after": "9/15/2025"
            }
          }
        },
        {
          "invoice_id": 83636,
          "changes": {
            "trandate": {
              "before": "2025-09-15",
              "after": "9/15/2025"
            }
          }
        },
        {
          "invoice_id": 28011,
          "changes": {
            "trandate": {
              "before": "2025-09-04",
              "after": "9/4/2025"
            }
          }
        },
        {
          "invoice_id": 27185,
          "changes": {
            "trandate": {
              "before": "2025-09-04",
              "after": "9/4/2025"
            }
          }
        },
        {
          "invoice_id": 27690,
          "changes": {
            "trandate": {
              "before": "2025-09-04",
              "after": "9/4/2025"
            }
          }
        },
        {
          "invoice_id": 25267,
          "changes": {
            "trandate": {
              "before": "2025-09-03",
              "after": "9/3/2025"
            }
          }
        },
        {
          "invoice_id": 25570,
          "changes": {
            "trandate": {
              "before": "2025-09-03",
              "after": "9/3/2025"
            }
          }
        },
        {
          "invoice_id": 25954,
          "changes": {
            "trandate": {
              "before": "2025-09-03",
              "after": "9/3/2025"
            }
          }
        },
        {
          "invoice_id": 24661,
          "changes": {
            "trandate": {
              "before": "2025-09-03",
              "after": "9/3/2025"
            }
          }
        },
        {
          "invoice_id": 29833,
          "changes": {
            "trandate": {
              "before": "2025-09-04",
              "after": "9/4/2025"
            }
          }
        },
        {
          "invoice_id": 20053,
          "changes": {
            "trandate": {
              "before": "2025-09-02",
              "after": "9/2/2025"
            }
          }
        },
        {
          "invoice_id": 20752,
          "changes": {
            "trandate": {
              "before": "2025-09-02",
              "after": "9/2/2025"
            }
          }
        },
        {
          "invoice_id": 19742,
          "changes": {
            "trandate": {
              "before": "2025-09-02",
              "after": "9/2/2025"
            }
          }
        },
        {
          "invoice_id": 20143,
          "changes": {
            "trandate": {
              "before": "2025-09-02",
              "after": "9/2/2025"
            }
          }
        },
        {
          "invoice_id": 21651,
          "changes": {
            "trandate": {
              "before": "2025-09-03",
              "after": "9/3/2025"
            }
          }
        },
        {
          "invoice_id": 23026,
          "changes": {
            "trandate": {
              "before": "2025-09-03",
              "after": "9/3/2025"
            }
          }
        },
        {
          "invoice_id": 28468,
          "changes": {
            "trandate": {
              "before": "2025-09-04",
              "after": "9/4/2025"
            }
          }
        },
        {
          "invoice_id": 28690,
          "changes": {
            "trandate": {
              "before": "2025-09-04",
              "after": "9/4/2025"
            }
          }
        },
        {
          "invoice_id": 28474,
          "changes": {
            "trandate": {
              "before": "2025-09-04",
              "after": "9/4/2025"
            }
          }
        },
        {
          "invoice_id": 32573,
          "changes": {
            "trandate": {
              "before": "2025-09-05",
              "after": "9/5/2025"
            }
          }
        },
        {
          "invoice_id": 32577,
          "changes": {
            "trandate": {
              "before": "2025-09-05",
              "after": "9/5/2025"
            }
          }
        },
        {
          "invoice_id": 32770,
          "changes": {
            "trandate": {
              "before": "2025-09-05",
              "after": "9/5/2025"
            }
          }
        },
        {
          "invoice_id": 38361,
          "changes": {
            "trandate": {
              "before": "2025-09-05",
              "after": "9/5/2025"
            }
          }
        },
        {
          "invoice_id": 38365,
          "changes": {
            "trandate": {
              "before": "2025-09-05",
              "after": "9/5/2025"
            }
          }
        },
        {
          "invoice_id": 38360,
          "changes": {
            "trandate": {
              "before": "2025-09-05",
              "after": "9/5/2025"
            }
          }
        },
        {
          "invoice_id": 38379,
          "changes": {
            "trandate": {
              "before": "2025-09-05",
              "after": "9/5/2025"
            }
          }
        },
        {
          "invoice_id": 38603,
          "changes": {
            "trandate": {
              "before": "2025-09-05",
              "after": "9/5/2025"
            }
          }
        },
        {
          "invoice_id": 38604,
          "changes": {
            "trandate": {
              "before": "2025-09-05",
              "after": "9/5/2025"
            }
          }
        },
        {
          "invoice_id": 38607,
          "changes": {
            "trandate": {
              "before": "2025-09-05",
              "after": "9/5/2025"
            }
          }
        },
        {
          "invoice_id": 38384,
          "changes": {
            "trandate": {
              "before": "2025-09-05",
              "after": "9/5/2025"
            }
          }
        },
        {
          "invoice_id": 38386,
          "changes": {
            "trandate": {
              "before": "2025-09-05",
              "after": "9/5/2025"
            }
          }
        },
        {
          "invoice_id": 38402,
          "changes": {
            "trandate": {
              "before": "2025-09-05",
              "after": "9/5/2025"
            }
          }
        },
        {
          "invoice_id": 38404,
          "changes": {
            "trandate": {
              "before": "2025-09-05",
              "after": "9/5/2025"
            }
          }
        },
        {
          "invoice_id": 38420,
          "changes": {
            "trandate": {
              "before": "2025-09-05",
              "after": "9/5/2025"
            }
          }
        },
        {
          "invoice_id": 38432,
          "changes": {
            "trandate": {
              "before": "2025-09-05",
              "after": "9/5/2025"
            }
          }
        },
        {
          "invoice_id": 38445,
          "changes": {
            "trandate": {
              "before": "2025-09-05",
              "after": "9/5/2025"
            }
          }
        },
        {
          "invoice_id": 38452,
          "changes": {
            "trandate": {
              "before": "2025-09-05",
              "after": "9/5/2025"
            }
          }
        },
        {
          "invoice_id": 38403,
          "changes": {
            "trandate": {
              "before": "2025-09-05",
              "after": "9/5/2025"
            }
          }
        },
        {
          "invoice_id": 38695,
          "changes": {
            "trandate": {
              "before": "2025-09-05",
              "after": "9/5/2025"
            }
          }
        },
        {
          "invoice_id": 38490,
          "changes": {
            "trandate": {
              "before": "2025-09-05",
              "after": "9/5/2025"
            }
          }
        },
        {
          "invoice_id": 38498,
          "changes": {
            "trandate": {
              "before": "2025-09-05",
              "after": "9/5/2025"
            }
          }
        },
        {
          "invoice_id": 38505,
          "changes": {
            "trandate": {
              "before": "2025-09-05",
              "after": "9/5/2025"
            }
          }
        },
        {
          "invoice_id": 38738,
          "changes": {
            "trandate": {
              "before": "2025-09-05",
              "after": "9/5/2025"
            }
          }
        },
        {
          "invoice_id": 38426,
          "changes": {
            "trandate": {
              "before": "2025-09-05",
              "after": "9/5/2025"
            }
          }
        },
        {
          "invoice_id": 38568,
          "changes": {
            "trandate": {
              "before": "2025-09-05",
              "after": "9/5/2025"
            }
          }
        },
        {
          "invoice_id": 38619,
          "changes": {
            "trandate": {
              "before": "2025-09-05",
              "after": "9/5/2025"
            }
          }
        },
        {
          "invoice_id": 38558,
          "changes": {
            "trandate": {
              "before": "2025-09-05",
              "after": "9/5/2025"
            }
          }
        },
        {
          "invoice_id": 39099,
          "changes": {
            "trandate": {
              "before": "2025-09-05",
              "after": "9/5/2025"
            }
          }
        },
        {
          "invoice_id": 39123,
          "changes": {
            "trandate": {
              "before": "2025-09-05",
              "after": "9/5/2025"
            }
          }
        },
        {
          "invoice_id": 38939,
          "changes": {
            "trandate": {
              "before": "2025-09-05",
              "after": "9/5/2025"
            }
          }
        },
        {
          "invoice_id": 38962,
          "changes": {
            "trandate": {
              "before": "2025-09-05",
              "after": "9/5/2025"
            }
          }
        },
        {
          "invoice_id": 39030,
          "changes": {
            "trandate": {
              "before": "2025-09-05",
              "after": "9/5/2025"
            }
          }
        },
        {
          "invoice_id": 38990,
          "changes": {
            "trandate": {
              "before": "2025-09-05",
              "after": "9/5/2025"
            }
          }
        },
        {
          "invoice_id": 38994,
          "changes": {
            "trandate": {
              "before": "2025-09-05",
              "after": "9/5/2025"
            }
          }
        },
        {
          "invoice_id": 38598,
          "changes": {
            "trandate": {
              "before": "2025-09-05",
              "after": "9/5/2025"
            }
          }
        },
        {
          "invoice_id": 39037,
          "changes": {
            "trandate": {
              "before": "2025-09-05",
              "after": "9/5/2025"
            }
          }
        },
        {
          "invoice_id": 38919,
          "changes": {
            "trandate": {
              "before": "2025-09-05",
              "after": "9/5/2025"
            }
          }
        },
        {
          "invoice_id": 39045,
          "changes": {
            "trandate": {
              "before": "2025-09-05",
              "after": "9/5/2025"
            }
          }
        },
        {
          "invoice_id": 38937,
          "changes": {
            "trandate": {
              "before": "2025-09-05",
              "after": "9/5/2025"
            }
          }
        },
        {
          "invoice_id": 39065,
          "changes": {
            "trandate": {
              "before": "2025-09-05",
              "after": "9/5/2025"
            }
          }
        },
        {
          "invoice_id": 39079,
          "changes": {
            "trandate": {
              "before": "2025-09-05",
              "after": "9/5/2025"
            }
          }
        },
        {
          "invoice_id": 38504,
          "changes": {
            "trandate": {
              "before": "2025-09-05",
              "after": "9/5/2025"
            }
          }
        },
        {
          "invoice_id": 37931,
          "changes": {
            "trandate": {
              "before": "2025-09-05",
              "after": "9/5/2025"
            }
          }
        },
        {
          "invoice_id": 38554,
          "changes": {
            "trandate": {
              "before": "2025-09-05",
              "after": "9/5/2025"
            }
          }
        },
        {
          "invoice_id": 44497,
          "changes": {
            "trandate": {
              "before": "2025-09-06",
              "after": "9/6/2025"
            }
          }
        },
        {
          "invoice_id": 48038,
          "changes": {
            "trandate": {
              "before": "2025-09-07",
              "after": "9/7/2025"
            }
          }
        },
        {
          "invoice_id": 52636,
          "changes": {
            "trandate": {
              "before": "2025-09-08",
              "after": "9/8/2025"
            }
          }
        },
        {
          "invoice_id": 48720,
          "changes": {
            "trandate": {
              "before": "2025-09-07",
              "after": "9/7/2025"
            }
          }
        },
        {
          "invoice_id": 47325,
          "changes": {
            "trandate": {
              "before": "2025-09-07",
              "after": "9/7/2025"
            }
          }
        },
        {
          "invoice_id": 48425,
          "changes": {
            "trandate": {
              "before": "2025-09-07",
              "after": "9/7/2025"
            }
          }
        },
        {
          "invoice_id": 52032,
          "changes": {
            "trandate": {
              "before": "2025-09-08",
              "after": "9/8/2025"
            }
          }
        },
        {
          "invoice_id": 50023,
          "changes": {
            "trandate": {
              "before": "2025-09-07",
              "after": "9/7/2025"
            }
          }
        },
        {
          "invoice_id": 50328,
          "changes": {
            "trandate": {
              "before": "2025-09-08",
              "after": "9/8/2025"
            }
          }
        },
        {
          "invoice_id": 53452,
          "changes": {
            "trandate": {
              "before": "2025-09-08",
              "after": "9/8/2025"
            }
          }
        },
        {
          "invoice_id": 53445,
          "changes": {
            "trandate": {
              "before": "2025-09-08",
              "after": "9/8/2025"
            }
          }
        },
        {
          "invoice_id": 46711,
          "changes": {
            "trandate": {
              "before": "2025-09-07",
              "after": "9/7/2025"
            }
          }
        },
        {
          "invoice_id": 46816,
          "changes": {
            "trandate": {
              "before": "2025-09-07",
              "after": "9/7/2025"
            }
          }
        },
        {
          "invoice_id": 52435,
          "changes": {
            "trandate": {
              "before": "2025-09-08",
              "after": "9/8/2025"
            }
          }
        },
        {
          "invoice_id": 48930,
          "changes": {
            "trandate": {
              "before": "2025-09-07",
              "after": "9/7/2025"
            }
          }
        },
        {
          "invoice_id": 49621,
          "changes": {
            "trandate": {
              "before": "2025-09-07",
              "after": "9/7/2025"
            }
          }
        },
        {
          "invoice_id": 41188,
          "changes": {
            "trandate": {
              "before": "2025-09-05",
              "after": "9/5/2025"
            }
          }
        },
        {
          "invoice_id": 53740,
          "changes": {
            "trandate": {
              "before": "2025-09-08",
              "after": "9/8/2025"
            }
          }
        },
        {
          "invoice_id": 40214,
          "changes": {
            "trandate": {
              "before": "2025-09-05",
              "after": "9/5/2025"
            }
          }
        },
        {
          "invoice_id": 51236,
          "changes": {
            "trandate": {
              "before": "2025-09-08",
              "after": "9/8/2025"
            }
          }
        },
        {
          "invoice_id": 53042,
          "changes": {
            "trandate": {
              "before": "2025-09-08",
              "after": "9/8/2025"
            }
          }
        },
        {
          "invoice_id": 54642,
          "changes": {
            "trandate": {
              "before": "2025-09-08",
              "after": "9/8/2025"
            }
          }
        },
        {
          "invoice_id": 59540,
          "changes": {
            "trandate": {
              "before": "2025-09-09",
              "after": "9/9/2025"
            }
          }
        },
        {
          "invoice_id": 53137,
          "changes": {
            "trandate": {
              "before": "2025-09-08",
              "after": "9/8/2025"
            }
          }
        },
        {
          "invoice_id": 59331,
          "changes": {
            "trandate": {
              "before": "2025-09-09",
              "after": "9/9/2025"
            }
          }
        },
        {
          "invoice_id": 75329,
          "changes": {
            "trandate": {
              "before": "2025-09-12",
              "after": "9/12/2025"
            }
          }
        },
        {
          "invoice_id": 62474,
          "changes": {
            "trandate": {
              "before": "2025-09-09",
              "after": "9/9/2025"
            }
          }
        },
        {
          "invoice_id": 63662,
          "changes": {
            "trandate": {
              "before": "2025-09-10",
              "after": "9/10/2025"
            }
          }
        },
        {
          "invoice_id": 83753,
          "changes": {
            "trandate": {
              "before": "2025-09-15",
              "after": "9/15/2025"
            }
          }
        },
        {
          "invoice_id": 83756,
          "changes": {
            "trandate": {
              "before": "2025-09-15",
              "after": "9/15/2025"
            }
          }
        },
        {
          "invoice_id": 70592,
          "changes": {
            "trandate": {
              "before": "2025-09-11",
              "after": "9/11/2025"
            }
          }
        },
        {
          "invoice_id": 62169,
          "changes": {
            "trandate": {
              "before": "2025-09-09",
              "after": "9/9/2025"
            }
          }
        },
        {
          "invoice_id": 62276,
          "changes": {
            "trandate": {
              "before": "2025-09-09",
              "after": "9/9/2025"
            }
          }
        },
        {
          "invoice_id": 62673,
          "changes": {
            "trandate": {
              "before": "2025-09-10",
              "after": "9/10/2025"
            }
          }
        },
        {
          "invoice_id": 83793,
          "changes": {
            "trandate": {
              "before": "2025-09-15",
              "after": "9/15/2025"
            }
          }
        },
        {
          "invoice_id": 63061,
          "changes": {
            "trandate": {
              "before": "2025-09-10",
              "after": "9/10/2025"
            }
          }
        },
        {
          "invoice_id": 83770,
          "changes": {
            "trandate": {
              "before": "2025-09-15",
              "after": "9/15/2025"
            }
          }
        },
        {
          "invoice_id": 77951,
          "changes": {
            "trandate": {
              "before": "2025-09-12",
              "after": "9/12/2025"
            }
          }
        },
        {
          "invoice_id": 74827,
          "changes": {
            "trandate": {
              "before": "2025-09-12",
              "after": "9/12/2025"
            }
          }
        },
        {
          "invoice_id": 77448,
          "changes": {
            "trandate": {
              "before": "2025-09-12",
              "after": "9/12/2025"
            }
          }
        },
        {
          "invoice_id": 83806,
          "changes": {
            "trandate": {
              "before": "2025-09-15",
              "after": "9/15/2025"
            }
          }
        },
        {
          "invoice_id": 83732,
          "changes": {
            "trandate": {
              "before": "2025-09-15",
              "after": "9/15/2025"
            }
          }
        },
        {
          "invoice_id": 71913,
          "changes": {
            "trandate": {
              "before": "2025-09-11",
              "after": "9/11/2025"
            }
          }
        },
        {
          "invoice_id": 82452,
          "changes": {
            "trandate": {
              "before": "2025-09-15",
              "after": "9/15/2025"
            }
          }
        },
        {
          "invoice_id": 68888,
          "changes": {
            "trandate": {
              "before": "2025-09-10",
              "after": "9/10/2025"
            }
          }
        },
        {
          "invoice_id": 79377,
          "changes": {
            "trandate": {
              "before": "2025-09-13",
              "after": "9/13/2025"
            }
          }
        },
        {
          "invoice_id": 83410,
          "changes": {
            "trandate": {
              "before": "2025-09-15",
              "after": "9/15/2025"
            }
          }
        },
        {
          "invoice_id": 83411,
          "changes": {
            "trandate": {
              "before": "2025-09-15",
              "after": "9/15/2025"
            }
          }
        },
        {
